{
  "C": {
    "cid_integrity_percent": 100,
    "completion_p95_ms": 30000,
    "concurrency": 64,
    "content_buckets": [
      {
        "proportion_percent": 35,
        "range": "0..=64KiB"
      },
      {
        "proportion_percent": 30,
        "range": ">64KiB..=1MiB"
      },
      {
        "proportion_percent": 25,
        "range": ">1MiB..=16MiB"
      },
      {
        "proportion_percent": 10,
        "range": ">16MiB..=256MiB"
      }
    ],
    "failover_success_percent": 99,
    "mix_percent": {
      "failover": 20,
      "multi_chunk": 45,
      "small_single_block": 35
    },
    "network": {
      "bandwidth_mbps": 100,
      "latency_ms": 50,
      "loss_percent": 1
    },
    "provider_count": 3,
    "provider_topology": "three independent provider processes across distinct failure domains",
    "request_rate_per_second": 32,
    "retries": 2,
    "success_percent": 99.9,
    "throughput_floor_mib_per_second": 5,
    "timeout_ms": 30000,
    "ttfb_p95_ms": 1000
  },
  "E": {
    "mix_percent": {
      "assets": 10,
      "attestation": 15,
      "names": 15,
      "identity_personhood": 20,
      "sponsored_meta_tx": 15,
      "storage": 25
    },
    "observed_resource_utilization_max_percent": 90,
    "p95_finality_ms": 18000,
    "p95_inclusion_ms": 4000,
    "p95_resource_utilization_max_percent": 80,
    "sponsored_intent_success_percent": 99.9,
    "storage_headroom_min_percent": 20,
    "target_finalized_successful_extrinsics_per_second": 250
  },
  "Q": {
    "finalized_hash_required": true,
    "mix_percent": {
      "assets": 10,
      "attestation": 10,
      "names": 15,
      "identity_personhood": 15,
      "storage": 15,
      "subscriptions": 25,
      "system": 10
    },
    "reconnect_catchup_p95_ms": 5000,
    "request_p95_ms": 500,
    "request_success_percent": 99.9,
    "subscription_completeness_percent": 99.99,
    "subscription_delivery_p95_ms": 2000
  },
  "campaign": {
    "cooldown_seconds": 300,
    "interleaved_runs": 5,
    "max_clock_offset_ms": 50,
    "max_cv_percent": 10,
    "max_finality_lag_blocks": 15,
    "measurement_seconds": 1800,
    "seed": 20260713,
    "warmup_seconds": 600
  },
  "manifest_version": 1,
  "network": {
    "aura_slot_ms": 6000,
    "orbis_collators": 2,
    "orbis_cores": [
      1,
      3
    ],
    "origin_validators": 6,
    "para_id": 1006,
    "relay_parent_offset": 1,
    "target_block_rate": 3,
    "unincluded_segment_capacity": 12
  },
  "ratification": {
    "canonical_envelope": "docs/evidence/verification/p5/sdk-freeze-ratification-envelope.json",
    "payload_sha256": "c04fdfe471cc307c028ef4e99e627517ab48e5afe92ac6e6fbbee84bda06bc6d",
    "sdk_freeze_status": "PENDING",
    "production_activation_status": "BLOCKED"
  },
  "status": "proposed-unratified"
}
